{
  "unit_name": "Marine Expeditionary Unit (Template)",
  "echelon": "MEU",
  "type": "MAGTF",
  "approximate": true,
  "notes": "Typical MEU composition: CE + BLT (GCE) + ACE (Composite Squadron) + LCE (CLB). Composition is drawn from subordinate units of the parent Division (GCE), MAW (ACE), and MLG (LCE).",
  "provenance": {
    "sources": [
      {
        "title": "MCRP 1-10.1 Organization of the United States Marine Corps",
        "citation": "MCRP 1-10.1",
        "url": "https://www.marines.mil/Portals/1/Publications/MCRP%201-10.1.pdf"
      },
      {
        "title": "MCWP 5-10 Marine Corps Planning Process",
        "citation": "MCWP 5-10",
        "url": "https://www.marines.mil/Portals/1/Publications/MCWP%205-10.pdf"
      },
      {
        "title": "MARADMIN 332/25 - Publication of FY 2025-2045 T/O&E & ASR",
        "citation": "MARADMIN 332/25 (17 Jul 2025)",
        "url": "https://www.marines.mil/News/Messages/"
      }
    ],
    "last_reviewed": "2025-10-18"
  },
  "default_agents": [
    "Commander",
    "S1",
    "S2",
    "S3",
    "S4",
    "S6",
    "SJA",
    "PAO"
  ],
  "children": [
    {
      "unit_name": "Command Element (CE)",
      "echelon": "OTHER",
      "type": "CE",
      "magtaf_element": "CE",
      "approximate": true,
      "provenance": {
        "sources": [
          {
            "title": "MCRP 1-10.1 Organization of the United States Marine Corps",
            "citation": "MCRP 1-10.1",
            "url": "https://www.marines.mil/Portals/1/Publications/MCRP%201-10.1.pdf"
          },
          {
            "title": "MCWP 5-10 Marine Corps Planning Process",
            "citation": "MCWP 5-10",
            "url": "https://www.marines.mil/Portals/1/Publications/MCWP%205-10.pdf"
          },
          {
            "title": "MARADMIN 332/25 - Publication of FY 2025-2045 T/O&E & ASR",
            "citation": "MARADMIN 332/25 (17 Jul 2025)",
            "url": "https://www.marines.mil/News/Messages/"
          }
        ],
        "last_reviewed": "2025-10-18"
      },
      "children": []
    },
    {
      "unit_name": "Battalion Landing Team (BLT)",
      "echelon": "BATTALION",
      "type": "Infantry",
      "magtaf_element": "GCE",
      "approximate": true,
      "provenance": {
        "sources": [
          {
            "title": "MCRP 1-10.1 Organization of the United States Marine Corps",
            "citation": "MCRP 1-10.1",
            "url": "https://www.marines.mil/Portals/1/Publications/MCRP%201-10.1.pdf"
          },
          {
            "title": "MCWP 5-10 Marine Corps Planning Process",
            "citation": "MCWP 5-10",
            "url": "https://www.marines.mil/Portals/1/Publications/MCWP%205-10.pdf"
          },
          {
            "title": "MARADMIN 332/25 - Publication of FY 2025-2045 T/O&E & ASR",
            "citation": "MARADMIN 332/25 (17 Jul 2025)",
            "url": "https://www.marines.mil/News/Messages/"
          }
        ],
        "last_reviewed": "2025-10-18"
      },
      "children": []
    },
    {
      "unit_name": "ACE (Composite Squadron)",
      "echelon": "SQUADRON",
      "type": "Aviation",
      "magtaf_element": "ACE",
      "approximate": true,
      "provenance": {
        "sources": [
          {
            "title": "MCRP 1-10.1 Organization of the United States Marine Corps",
            "citation": "MCRP 1-10.1",
            "url": "https://www.marines.mil/Portals/1/Publications/MCRP%201-10.1.pdf"
          },
          {
            "title": "MCWP 5-10 Marine Corps Planning Process",
            "citation": "MCWP 5-10",
            "url": "https://www.marines.mil/Portals/1/Publications/MCWP%205-10.pdf"
          },
          {
            "title": "MARADMIN 332/25 - Publication of FY 2025-2045 T/O&E & ASR",
            "citation": "MARADMIN 332/25 (17 Jul 2025)",
            "url": "https://www.marines.mil/News/Messages/"
          }
        ],
        "last_reviewed": "2025-10-18"
      },
      "children": []
    },
    {
      "unit_name": "CLB (Logistics)",
      "echelon": "BATTALION",
      "type": "CLB",
      "magtaf_element": "LCE",
      "approximate": true,
      "provenance": {
        "sources": [
          {
            "title": "MCRP 1-10.1 Organization of the United States Marine Corps",
            "citation": "MCRP 1-10.1",
            "url": "https://www.marines.mil/Portals/1/Publications/MCRP%201-10.1.pdf"
          },
          {
            "title": "MCWP 5-10 Marine Corps Planning Process",
            "citation": "MCWP 5-10",
            "url": "https://www.marines.mil/Portals/1/Publications/MCWP%205-10.pdf"
          },
          {
            "title": "MARADMIN 332/25 - Publication of FY 2025-2045 T/O&E & ASR",
            "citation": "MARADMIN 332/25 (17 Jul 2025)",
            "url": "https://www.marines.mil/News/Messages/"
          }
        ],
        "last_reviewed": "2025-10-18"
      },
      "children": []
    }
  ]
}
